{"$id":"urn:rd22:step11:partial-box-instance:v001","$schema":"https://json-schema.org/draft/2020-12/schema","additionalProperties":false,"properties":{"admission":{"const":"BARRED_STEP11_SUBGATE"},"box_id":{"minLength":1,"type":"string"},"box_schema_id":{"minLength":1,"type":"string"},"completeness":{"const":"PARTIAL"},"grounded_elements":{"items":{"$ref":"#/$defs/grounded_element"},"type":"array"},"missing_elements":{"items":{"$ref":"#/$defs/missing_element"},"minItems":1,"type":"array"},"row_id":{"minLength":1,"type":"string"},"schema":{"const":"rd22.step11.partial-box-instance.v001"},"source_bindings":{"items":{"$ref":"#/$defs/source_binding"},"minItems":1,"type":"array"},"target_id":{"minLength":1,"type":"string"}},"required":["schema","target_id","box_id","row_id","box_schema_id","completeness","source_bindings","grounded_elements","missing_elements","admission"],"type":"object","$defs":{"grounded_element":{"additionalProperties":false,"properties":{"field_path":{"minLength":1,"type":"string"},"payload_byte_length":{"minimum":0,"type":"integer"},"payload_relative_path":{"minLength":1,"type":"string"},"payload_sha256":{"pattern":"^[0-9a-f]{64}$","type":"string"},"source_binding_index":{"minimum":0,"type":"integer"}},"required":["field_path","payload_relative_path","payload_sha256","payload_byte_length","source_binding_index"],"type":"object"},"missing_element":{"additionalProperties":false,"properties":{"absence_binding_index":{"minimum":0,"type":"integer"},"field_path":{"minLength":1,"type":"string"},"owner":{"minLength":1,"type":"string"},"reason_code":{"enum":["ABSENT_OF_RECORD","UNDERDETERMINED_OF_RECORD"],"type":"string"}},"required":["field_path","owner","reason_code","absence_binding_index"],"type":"object"},"source_binding":{"additionalProperties":false,"properties":{"relative_path":{"minLength":1,"type":"string"},"role":{"enum":["GROUNDING","ABSENCE_FINDING"],"type":"string"},"source_sha256":{"pattern":"^[0-9a-f]{64}$","type":"string"},"span":{"items":false,"maxItems":2,"minItems":2,"prefixItems":[{"minimum":0,"type":"integer"},{"minimum":0,"type":"integer"}],"type":"array"},"span_sha256":{"pattern":"^[0-9a-f]{64}$","type":"string"}},"required":["relative_path","source_sha256","span","span_sha256","role"],"type":"object"}}}
