{"admission":"BARRED_STEP11_SUBGATE","box_id":"BX03-V008-10-CONTENT-ADDRESSED-PARENT-MAP","box_schema_id":"urn:rd22:step11:v008-10:content-addressed-parent-map:v001","completeness":"PARTIAL","grounded_elements":[{"field_path":"stages.name_parent_adjacency_only","payload_byte_length":910,"payload_relative_path":"payloads/889515d30cedf7d3af5da1a9e1ff7c7a88a1bf0d9227bdf37d64113302dfcb86.bin","payload_sha256":"889515d30cedf7d3af5da1a9e1ff7c7a88a1bf0d9227bdf37d64113302dfcb86","source_binding_index":0}],"missing_elements":[{"absence_binding_index":1,"field_path":"stages[*].artifact","owner":"7A_FORMALIZATION:content-addressed stage artifacts","reason_code":"ABSENT_OF_RECORD"},{"absence_binding_index":1,"field_path":"stages[*].parents[*].artifact_sha256","owner":"7A_FORMALIZATION:artifact-digest parent bindings","reason_code":"ABSENT_OF_RECORD"},{"absence_binding_index":1,"field_path":"parent_map_root","owner":"7A_FORMALIZATION:root over content-addressed parent map","reason_code":"ABSENT_OF_RECORD"}],"row_id":"C-B-V008-10","schema":"rd22.step11.partial-box-instance.v001","source_bindings":[{"relative_path":"provenance/boundary_incidence_dynamics_preregistration_v011.json","role":"GROUNDING","source_sha256":"13cf1e178a9fdced88590998984ec04e84ed83c0681b68dccd11b4e37d6afacd","span":[18920,19830],"span_sha256":"889515d30cedf7d3af5da1a9e1ff7c7a88a1bf0d9227bdf37d64113302dfcb86"},{"relative_path":"STAGE8_TASK6_GROUNDING_RELOCATION_DARIO_V001.md","role":"ABSENCE_FINDING","source_sha256":"69334875b94679c16da9b8d6153242241ca3c202f0facc6130596b9807189e6f","span":[7550,7719],"span_sha256":"dbade4c277b67e22c12584590d153f6d19c32f0a6cfd45dd064feb6d6cf39905"}],"target_id":"CS:C-B-V008-10:seal-stage-graph"}