{"admission":"BARRED_STEP11_SUBGATE","box_id":"BX09-V009-08-CITATION-CLAIM-GRAPH","box_schema_id":"urn:rd22:step11:v009-08:citation-claim-graph:v001","completeness":"PARTIAL","grounded_elements":[],"missing_elements":[{"absence_binding_index":0,"field_path":"authority_nodes","owner":"7A_FORMALIZATION:citation authority nodes and stable IDs","reason_code":"ABSENT_OF_RECORD"},{"absence_binding_index":0,"field_path":"claim_nodes","owner":"7A_FORMALIZATION:claim nodes and stable IDs","reason_code":"ABSENT_OF_RECORD"},{"absence_binding_index":0,"field_path":"entailment_edges","owner":"7A_FORMALIZATION:typed citation-to-claim entailment edges","reason_code":"ABSENT_OF_RECORD"},{"absence_binding_index":0,"field_path":"general_fs_premise","owner":"7A_FORMALIZATION:bounded general-FS premise carrier","reason_code":"ABSENT_OF_RECORD"}],"row_id":"C-B-V009-08","schema":"rd22.step11.partial-box-instance.v001","source_bindings":[{"relative_path":"STAGE8_TASK6_GROUNDING_RELOCATION_DARIO_V001.md","role":"ABSENCE_FINDING","source_sha256":"69334875b94679c16da9b8d6153242241ca3c202f0facc6130596b9807189e6f","span":[8069,8221],"span_sha256":"6e698bb4bce3b553a83c9eebe38a3f0d4fc0802da8618d4d64dcf627d9f4c152"}],"target_id":"CS:C-B-V009-08:citation-claim-graph"}