{"admission":"BARRED_STEP11_SUBGATE","box_id":"BX01-V008-05-NONCOMMUTING-PLAQUETTE","box_schema_id":"urn:rd22:step11:v008-05:noncommuting-plaquette:v001","completeness":"PARTIAL","grounded_elements":[{"field_path":"representation","payload_byte_length":52,"payload_relative_path":"payloads/9384b3c9328738d742902c76a8588c0d48891ccf2b984de6732490bc03f54108.bin","payload_sha256":"9384b3c9328738d742902c76a8588c0d48891ccf2b984de6732490bc03f54108","source_binding_index":0},{"field_path":"universal_word","payload_byte_length":39,"payload_relative_path":"payloads/6828baed8c450bda097c5e9e0b4185f4a1bd1cd9882be3eb1fcaf3b9f1e138ec.bin","payload_sha256":"6828baed8c450bda097c5e9e0b4185f4a1bd1cd9882be3eb1fcaf3b9f1e138ec","source_binding_index":1},{"field_path":"target_word","payload_byte_length":68,"payload_relative_path":"payloads/da5ffdaca00f942dbad5b41caff46ccd21d5265362921305de19c703906d1c97.bin","payload_sha256":"da5ffdaca00f942dbad5b41caff46ccd21d5265362921305de19c703906d1c97","source_binding_index":2}],"missing_elements":[{"absence_binding_index":3,"field_path":"inverse_competitor","owner":"7A_FORMALIZATION:canonical inverse/opposite holonomy competitor normal form","reason_code":"ABSENT_OF_RECORD"},{"absence_binding_index":3,"field_path":"fixture_assignments","owner":"7A_FORMALIZATION:noncommuting fixture assignments","reason_code":"ABSENT_OF_RECORD"}],"row_id":"C-B-V008-05","schema":"rd22.step11.partial-box-instance.v001","source_bindings":[{"relative_path":"review_packets/STAGE7_QSPEC_CANDIDATE_V001/BOUNDARY_INCIDENCE_DYNAMICS_PRINCIPLE_V011.md","role":"GROUNDING","source_sha256":"aa7c6d4904706276514728819df20f48e8fdca0ff83f97ad5f1724c5f81f108a","span":[32278,32330],"span_sha256":"9384b3c9328738d742902c76a8588c0d48891ccf2b984de6732490bc03f54108"},{"relative_path":"review_packets/STAGE7_QSPEC_CANDIDATE_V001/BOUNDARY_INCIDENCE_DYNAMICS_PRINCIPLE_V011.md","role":"GROUNDING","source_sha256":"aa7c6d4904706276514728819df20f48e8fdca0ff83f97ad5f1724c5f81f108a","span":[33012,33051],"span_sha256":"6828baed8c450bda097c5e9e0b4185f4a1bd1cd9882be3eb1fcaf3b9f1e138ec"},{"relative_path":"review_packets/STAGE7_QSPEC_CANDIDATE_V001/BOUNDARY_INCIDENCE_DYNAMICS_PRINCIPLE_V011.md","role":"GROUNDING","source_sha256":"aa7c6d4904706276514728819df20f48e8fdca0ff83f97ad5f1724c5f81f108a","span":[33855,33923],"span_sha256":"da5ffdaca00f942dbad5b41caff46ccd21d5265362921305de19c703906d1c97"},{"relative_path":"STAGE8_TASK6_GROUNDING_RELOCATION_DARIO_V001.md","role":"ABSENCE_FINDING","source_sha256":"69334875b94679c16da9b8d6153242241ca3c202f0facc6130596b9807189e6f","span":[8913,9460],"span_sha256":"01a094eeb86e77f2dab6ff3e0e80623e396f8098eecf82d000829b3909d97834"}],"target_id":"MG:C-B-V008-05:inverse-opposite-holonomy-competitor"}